brand,name,material,is_locking,description
Graph Tech,Gibson Graph Tech Nut,TUSQ,false,Graph Tech TUSQ synthetic nut; used on Les Paul Standard 50s/60s and Studio
Graph Tech,Gibson Graph Tech Nut Wide,TUSQ,false,Graph Tech TUSQ nut (42.85 mm) used on Les Paul Custom
Graph Tech,SG Graph Tech Nut,TUSQ,false,Graph Tech TUSQ nut used on SG Modern and ES-339
Gibson,Gibson Corian Nut,Corian,false,Corian composite nut used on Les Paul Custom 70s and some USA Gibson models
Graph Tech,Epiphone Graph Tech Nut,TUSQ,false,Graph Tech TUSQ nut used on Epiphone SG Standard
Graph Tech,Epiphone Casino Graph Tech Nut,TUSQ,false,Graph Tech TUSQ nut (1.68 in / 42.7 mm) used on Epiphone Casino
